[
  {
    "spec_id": "br-v0-001",
    "reviewer": "Yuhang",
    "status": "approved",
    "checks": {
      "object": true,
      "signal": true,
      "operator": true,
      "comparator": true,
      "threshold": true,
      "deadline": true,
      "equality": true,
      "terminal_semantics": true,
      "paraphrase_equivalence": true
    },
    "disagreement_notes": null,
    "reviewed_at": "2026-08-12T21:38:22-07:00"
  },
  {
    "spec_id": "br-v0-002",
    "reviewer": "Yuhang",
    "status": "approved",
    "checks": {
      "object": true,
      "signal": true,
      "operator": true,
      "comparator": true,
      "threshold": true,
      "deadline": true,
      "equality": true,
      "terminal_semantics": true,
      "paraphrase_equivalence": true
    },
    "disagreement_notes": null,
    "reviewed_at": "2026-08-12T21:38:22-07:00"
  },
  {
    "spec_id": "br-v0-003",
    "reviewer": "Yuhang",
    "status": "approved",
    "checks": {
      "object": true,
      "signal": true,
      "operator": true,
      "comparator": true,
      "threshold": true,
      "deadline": true,
      "equality": true,
      "terminal_semantics": true,
      "paraphrase_equivalence": true
    },
    "disagreement_notes": null,
    "reviewed_at": "2026-08-12T21:38:22-07:00"
  },
  {
    "spec_id": "br-v0-004",
    "reviewer": "Yuhang",
    "status": "approved",
    "checks": {
      "object": true,
      "signal": true,
      "operator": true,
      "comparator": true,
      "threshold": true,
      "deadline": true,
      "equality": true,
      "terminal_semantics": true,
      "paraphrase_equivalence": true
    },
    "disagreement_notes": null,
    "reviewed_at": "2026-08-12T21:38:22-07:00"
  },
  {
    "spec_id": "br-v0-005",
    "reviewer": "Yuhang",
    "status": "approved",
    "checks": {
      "object": true,
      "signal": true,
      "operator": true,
      "comparator": true,
      "threshold": true,
      "deadline": true,
      "equality": true,
      "terminal_semantics": true,
      "paraphrase_equivalence": true
    },
    "disagreement_notes": null,
    "reviewed_at": "2026-08-12T21:38:22-07:00"
  },
  {
    "spec_id": "br-v0-006",
    "reviewer": "jiahui",
    "status": "approved",
    "checks": {
      "object": true,
      "signal": true,
      "operator": true,
      "comparator": true,
      "threshold": true,
      "deadline": true,
      "equality": true,
      "terminal_semantics": true,
      "paraphrase_equivalence": true
    },
    "disagreement_notes": null,
    "reviewed_at": "2026-08-14T15:00:52-07:00"
  },
  {
    "spec_id": "br-v0-007",
    "reviewer": "jiahui",
    "status": "approved",
    "checks": {
      "object": true,
      "signal": true,
      "operator": true,
      "comparator": true,
      "threshold": true,
      "deadline": true,
      "equality": true,
      "terminal_semantics": true,
      "paraphrase_equivalence": true
    },
    "disagreement_notes": null,
    "reviewed_at": "2026-08-14T15:00:52-07:00"
  },
  {
    "spec_id": "br-v0-008",
    "reviewer": "jiahui",
    "status": "approved",
    "checks": {
      "object": true,
      "signal": true,
      "operator": true,
      "comparator": true,
      "threshold": true,
      "deadline": true,
      "equality": true,
      "terminal_semantics": true,
      "paraphrase_equivalence": true
    },
    "disagreement_notes": null,
    "reviewed_at": "2026-08-14T15:00:52-07:00"
  },
  {
    "spec_id": "rp-v0-001",
    "reviewer": "jiahui",
    "status": "approved",
    "checks": {
      "object": true,
      "signal": true,
      "operator": true,
      "comparator": true,
      "threshold": true,
      "deadline": true,
      "equality": true,
      "terminal_semantics": true,
      "paraphrase_equivalence": true
    },
    "disagreement_notes": null,
    "reviewed_at": "2026-08-14T15:00:52-07:00"
  },
  {
    "spec_id": "rp-v0-002",
    "reviewer": "jiahui",
    "status": "approved",
    "checks": {
      "object": true,
      "signal": true,
      "operator": true,
      "comparator": true,
      "threshold": true,
      "deadline": true,
      "equality": true,
      "terminal_semantics": true,
      "paraphrase_equivalence": true
    },
    "disagreement_notes": null,
    "reviewed_at": "2026-08-14T15:00:52-07:00"
  },
  {
    "spec_id": "rp-v0-003",
    "reviewer": "jiahui",
    "status": "approved",
    "checks": {
      "object": true,
      "signal": true,
      "operator": true,
      "comparator": true,
      "threshold": true,
      "deadline": true,
      "equality": true,
      "terminal_semantics": true,
      "paraphrase_equivalence": true
    },
    "disagreement_notes": null,
    "reviewed_at": "2026-08-14T15:00:52-07:00"
  },
  {
    "spec_id": "rp-v0-004",
    "reviewer": "jiahui",
    "status": "approved",
    "checks": {
      "object": true,
      "signal": true,
      "operator": true,
      "comparator": true,
      "threshold": true,
      "deadline": true,
      "equality": true,
      "terminal_semantics": true,
      "paraphrase_equivalence": true
    },
    "disagreement_notes": null,
    "reviewed_at": "2026-08-14T15:00:52-07:00"
  },
  {
    "spec_id": "rp-v0-005",
    "reviewer": "jiahui",
    "status": "approved",
    "checks": {
      "object": true,
      "signal": true,
      "operator": true,
      "comparator": true,
      "threshold": true,
      "deadline": true,
      "equality": true,
      "terminal_semantics": true,
      "paraphrase_equivalence": true
    },
    "disagreement_notes": null,
    "reviewed_at": "2026-08-14T15:00:52-07:00"
  },
  {
    "spec_id": "rp-v0-006",
    "reviewer": "jiahui",
    "status": "approved",
    "checks": {
      "object": true,
      "signal": true,
      "operator": true,
      "comparator": true,
      "threshold": true,
      "deadline": true,
      "equality": true,
      "terminal_semantics": true,
      "paraphrase_equivalence": true
    },
    "disagreement_notes": null,
    "reviewed_at": "2026-08-14T15:00:52-07:00"
  },
  {
    "spec_id": "rp-v0-007",
    "reviewer": "jiahui",
    "status": "approved",
    "checks": {
      "object": true,
      "signal": true,
      "operator": true,
      "comparator": true,
      "threshold": true,
      "deadline": true,
      "equality": true,
      "terminal_semantics": true,
      "paraphrase_equivalence": true
    },
    "disagreement_notes": null,
    "reviewed_at": "2026-08-14T15:00:52-07:00"
  },
  {
    "spec_id": "rp-v0-008",
    "reviewer": "jiahui",
    "status": "approved",
    "checks": {
      "object": true,
      "signal": true,
      "operator": true,
      "comparator": true,
      "threshold": true,
      "deadline": true,
      "equality": true,
      "terminal_semantics": true,
      "paraphrase_equivalence": true
    },
    "disagreement_notes": null,
    "reviewed_at": "2026-08-14T15:00:52-07:00"
  },
  {
    "spec_id": "ba-v0-001",
    "reviewer": "jiahui",
    "status": "approved",
    "checks": {
      "object": true,
      "signal": true,
      "operator": true,
      "comparator": true,
      "threshold": true,
      "deadline": true,
      "equality": true,
      "terminal_semantics": true,
      "paraphrase_equivalence": true
    },
    "disagreement_notes": null,
    "reviewed_at": "2026-08-14T15:00:52-07:00"
  },
  {
    "spec_id": "ba-v0-002",
    "reviewer": "jiahui",
    "status": "approved",
    "checks": {
      "object": true,
      "signal": true,
      "operator": true,
      "comparator": true,
      "threshold": true,
      "deadline": true,
      "equality": true,
      "terminal_semantics": true,
      "paraphrase_equivalence": true
    },
    "disagreement_notes": null,
    "reviewed_at": "2026-08-14T15:00:52-07:00"
  },
  {
    "spec_id": "ba-v0-003",
    "reviewer": "jiahui",
    "status": "approved",
    "checks": {
      "object": true,
      "signal": true,
      "operator": true,
      "comparator": true,
      "threshold": true,
      "deadline": true,
      "equality": true,
      "terminal_semantics": true,
      "paraphrase_equivalence": true
    },
    "disagreement_notes": null,
    "reviewed_at": "2026-08-14T15:00:52-07:00"
  },
  {
    "spec_id": "ba-v0-004",
    "reviewer": "jiahui",
    "status": "approved",
    "checks": {
      "object": true,
      "signal": true,
      "operator": true,
      "comparator": true,
      "threshold": true,
      "deadline": true,
      "equality": true,
      "terminal_semantics": true,
      "paraphrase_equivalence": true
    },
    "disagreement_notes": null,
    "reviewed_at": "2026-08-14T15:00:52-07:00"
  },
  {
    "spec_id": "ba-v0-005",
    "reviewer": "jiahui",
    "status": "approved",
    "checks": {
      "object": true,
      "signal": true,
      "operator": true,
      "comparator": true,
      "threshold": true,
      "deadline": true,
      "equality": true,
      "terminal_semantics": true,
      "paraphrase_equivalence": true
    },
    "disagreement_notes": null,
    "reviewed_at": "2026-08-14T15:00:52-07:00"
  },
  {
    "spec_id": "ba-v0-006",
    "reviewer": "jiahui",
    "status": "approved",
    "checks": {
      "object": true,
      "signal": true,
      "operator": true,
      "comparator": true,
      "threshold": true,
      "deadline": true,
      "equality": true,
      "terminal_semantics": true,
      "paraphrase_equivalence": true
    },
    "disagreement_notes": null,
    "reviewed_at": "2026-08-14T15:00:52-07:00"
  },
  {
    "spec_id": "ba-v0-007",
    "reviewer": "jiahui",
    "status": "approved",
    "checks": {
      "object": true,
      "signal": true,
      "operator": true,
      "comparator": true,
      "threshold": true,
      "deadline": true,
      "equality": true,
      "terminal_semantics": true,
      "paraphrase_equivalence": true
    },
    "disagreement_notes": null,
    "reviewed_at": "2026-08-14T15:00:52-07:00"
  },
  {
    "spec_id": "ba-v0-008",
    "reviewer": "jiahui",
    "status": "approved",
    "checks": {
      "object": true,